{
  "approved_artifact_refs": [],
  "authority_class": "activate_run",
  "candidate_run_id": "tunsil-absence-shock-v0",
  "decision_ref": "https://github.com/Prometheus-Frameworks/TIBER-Research/issues/3#issuecomment-5283843131",
  "exclusions": [
    "Any movement of the reviewed package/head or change to the bound semantics voids this activation and requires fresh review and a new activation decision.",
    "No new sources, subjects, comparison population, post-cutoff evidence, network retrieval, or proxy data.",
    "No Forecast/Fantasy/ranking/lineup/betting mutation, promotion, downstream application, or public-safe publication; stop at the completed Research packet/submission for the bound independent-review lane."
  ],
  "operator": "Joseph (@Prometheus-Frameworks)",
  "operator_direction": "I approve activation of the bounded Tunsil absence-shock Research run against the independently reviewed frozen preflight package at TIBER-Research PR #7 head `c5e1e2c5ca03c8820acbc967f8897fe92620ace6`. This decision is intentionally separate from the earlier `stage1_preflight_only` authority.",
  "quote_digest": "sha256:ace10a137619acf62958f906e3f62a6e2be619f6a8fcc8b31d66a6cc8d9dcee3",
  "quote_digest_mode": "tiber-raw-sha256-v1",
  "recorded_at": "2026-08-13T17:00:15Z",
  "schema_version": "research-operator-direction-record/v1",
  "scope": [
    "Activate the bounded tunsil-absence-shock-v0 Research run against the frozen package at PR #7 head c5e1e2c5ca03c8820acbc967f8897fe92620ace6, binding candidate job sha256:74574487998d1400c04bf948af00ea8545a52cd067a550ae3ad92bc23d2bd6ff and candidate inputs sha256:13723b1a3899145d3d0153a06f1597c29396ce6dd927ae14f3636e42fc130f4c.",
    "Bind cutoff 2026-08-13T14:13:09Z, frozen package time 2026-08-13T16:23:04Z, budget 240 wall-clock minutes / 400 tool calls / 40 evidence objects, execution network denied, write scope runs/tunsil-absence-shock-v0/** in TIBER-Research only, reportability internal.",
    "Executor: Claude lane; fresh-context independent reviewer: GPT-5.6 Sol review lane.",
    "Before activation_ready may become true or execution begins: materialize the trusted denied-network enforcement receipt and the governed-artifact provenance receipts bound to this exact authority; if either receipt class cannot be produced truthfully, leave activation_ready false and do not execute.",
    "The run remains bound to the five atomic questions and preregistered H1/H2/H3 branches; allowed terminal decisions remain exactly the three preregistered terminals, with requires_data_followup a successful outcome."
  ],
  "terminal_outcomes": [
    "tunsil_absence_shock_v0_complete",
    "tunsil_absence_shock_v0_requires_data_followup",
    "tunsil_absence_shock_v0_blocked"
  ]
}
